{
  "blocks": [
    {
      "identity": {
        "mode": {
          "emulation": true,
          "m8": true,
          "x8": true
        },
        "pc": 35828,
        "processor": "sa1"
      },
      "instruction": {
        "addressing": "implied",
        "bytes_hex": "78",
        "flow": "next",
        "mnemonic": "SEI",
        "mode_after": {
          "emulation": true,
          "m8": true,
          "x8": true
        },
        "opcode": 120,
        "pc": 35828,
        "size": 1,
        "target": null
      },
      "rom_offset": 3060,
      "status": "decoded",
      "unresolved_reason": null
    },
    {
      "identity": {
        "mode": {
          "emulation": true,
          "m8": true,
          "x8": true
        },
        "pc": 35829,
        "processor": "sa1"
      },
      "instruction": {
        "addressing": "implied",
        "bytes_hex": "18",
        "flow": "next",
        "mnemonic": "CLC",
        "mode_after": {
          "emulation": true,
          "m8": true,
          "x8": true
        },
        "opcode": 24,
        "pc": 35829,
        "size": 1,
        "target": null
      },
      "rom_offset": 3061,
      "status": "decoded",
      "unresolved_reason": null
    },
    {
      "identity": {
        "mode": {
          "emulation": true,
          "m8": true,
          "x8": true
        },
        "pc": 35830,
        "processor": "sa1"
      },
      "instruction": {
        "addressing": "implied",
        "bytes_hex": "FB",
        "flow": "next",
        "mnemonic": "XCE",
        "mode_after": {
          "emulation": false,
          "m8": true,
          "x8": true
        },
        "opcode": 251,
        "pc": 35830,
        "size": 1,
        "target": null
      },
      "rom_offset": 3062,
      "status": "decoded",
      "unresolved_reason": null
    },
    {
      "identity": {
        "mode": {
          "emulation": false,
          "m8": true,
          "x8": true
        },
        "pc": 35831,
        "processor": "sa1"
      },
      "instruction": {
        "addressing": "immediate8",
        "bytes_hex": "E220",
        "flow": "next",
        "mnemonic": "SEP",
        "mode_after": {
          "emulation": false,
          "m8": true,
          "x8": true
        },
        "opcode": 226,
        "pc": 35831,
        "size": 2,
        "target": null
      },
      "rom_offset": 3063,
      "status": "decoded",
      "unresolved_reason": null
    },
    {
      "identity": {
        "mode": {
          "emulation": false,
          "m8": true,
          "x8": true
        },
        "pc": 35833,
        "processor": "sa1"
      },
      "instruction": {
        "addressing": "absolute",
        "bytes_hex": "9C3022",
        "flow": "next",
        "mnemonic": "STZ",
        "mode_after": {
          "emulation": false,
          "m8": true,
          "x8": true
        },
        "opcode": 156,
        "pc": 35833,
        "size": 3,
        "target": null
      },
      "rom_offset": 3065,
      "status": "decoded",
      "unresolved_reason": null
    },
    {
      "identity": {
        "mode": {
          "emulation": false,
          "m8": true,
          "x8": true
        },
        "pc": 35836,
        "processor": "sa1"
      },
      "instruction": {
        "addressing": "absolute",
        "bytes_hex": "9C0922",
        "flow": "next",
        "mnemonic": "STZ",
        "mode_after": {
          "emulation": false,
          "m8": true,
          "x8": true
        },
        "opcode": 156,
        "pc": 35836,
        "size": 3,
        "target": null
      },
      "rom_offset": 3068,
      "status": "decoded",
      "unresolved_reason": null
    },
    {
      "identity": {
        "mode": {
          "emulation": false,
          "m8": true,
          "x8": true
        },
        "pc": 35839,
        "processor": "sa1"
      },
      "instruction": {
        "addressing": "immediate_m",
        "bytes_hex": "A9FF",
        "flow": "next",
        "mnemonic": "LDA",
        "mode_after": {
          "emulation": false,
          "m8": true,
          "x8": true
        },
        "opcode": 169,
        "pc": 35839,
        "size": 2,
        "target": null
      },
      "rom_offset": 3071,
      "status": "decoded",
      "unresolved_reason": null
    },
    {
      "identity": {
        "mode": {
          "emulation": false,
          "m8": true,
          "x8": true
        },
        "pc": 35841,
        "processor": "sa1"
      },
      "instruction": {
        "addressing": "absolute",
        "bytes_hex": "8D2A22",
        "flow": "next",
        "mnemonic": "STA",
        "mode_after": {
          "emulation": false,
          "m8": true,
          "x8": true
        },
        "opcode": 141,
        "pc": 35841,
        "size": 3,
        "target": null
      },
      "rom_offset": 3073,
      "status": "decoded",
      "unresolved_reason": null
    },
    {
      "identity": {
        "mode": {
          "emulation": false,
          "m8": true,
          "x8": true
        },
        "pc": 35844,
        "processor": "sa1"
      },
      "instruction": {
        "addressing": "absolute",
        "bytes_hex": "9C2522",
        "flow": "next",
        "mnemonic": "STZ",
        "mode_after": {
          "emulation": false,
          "m8": true,
          "x8": true
        },
        "opcode": 156,
        "pc": 35844,
        "size": 3,
        "target": null
      },
      "rom_offset": 3076,
      "status": "decoded",
      "unresolved_reason": null
    },
    {
      "identity": {
        "mode": {
          "emulation": false,
          "m8": true,
          "x8": true
        },
        "pc": 35847,
        "processor": "sa1"
      },
      "instruction": {
        "addressing": "immediate_m",
        "bytes_hex": "A980",
        "flow": "next",
        "mnemonic": "LDA",
        "mode_after": {
          "emulation": false,
          "m8": true,
          "x8": true
        },
        "opcode": 169,
        "pc": 35847,
        "size": 2,
        "target": null
      },
      "rom_offset": 3079,
      "status": "decoded",
      "unresolved_reason": null
    },
    {
      "identity": {
        "mode": {
          "emulation": false,
          "m8": true,
          "x8": true
        },
        "pc": 35849,
        "processor": "sa1"
      },
      "instruction": {
        "addressing": "absolute",
        "bytes_hex": "8D2722",
        "flow": "next",
        "mnemonic": "STA",
        "mode_after": {
          "emulation": false,
          "m8": true,
          "x8": true
        },
        "opcode": 141,
        "pc": 35849,
        "size": 3,
        "target": null
      },
      "rom_offset": 3081,
      "status": "decoded",
      "unresolved_reason": null
    },
    {
      "identity": {
        "mode": {
          "emulation": false,
          "m8": true,
          "x8": true
        },
        "pc": 35852,
        "processor": "sa1"
      },
      "instruction": {
        "addressing": "absolute",
        "bytes_hex": "8D0A22",
        "flow": "next",
        "mnemonic": "STA",
        "mode_after": {
          "emulation": false,
          "m8": true,
          "x8": true
        },
        "opcode": 141,
        "pc": 35852,
        "size": 3,
        "target": null
      },
      "rom_offset": 3084,
      "status": "decoded",
      "unresolved_reason": null
    },
    {
      "identity": {
        "mode": {
          "emulation": false,
          "m8": true,
          "x8": true
        },
        "pc": 35855,
        "processor": "sa1"
      },
      "instruction": {
        "addressing": "absolute",
        "bytes_hex": "9C0030",
        "flow": "next",
        "mnemonic": "STZ",
        "mode_after": {
          "emulation": false,
          "m8": true,
          "x8": true
        },
        "opcode": 156,
        "pc": 35855,
        "size": 3,
        "target": null
      },
      "rom_offset": 3087,
      "status": "decoded",
      "unresolved_reason": null
    },
    {
      "identity": {
        "mode": {
          "emulation": false,
          "m8": true,
          "x8": true
        },
        "pc": 35858,
        "processor": "sa1"
      },
      "instruction": {
        "addressing": "absolute",
        "bytes_hex": "9C0060",
        "flow": "next",
        "mnemonic": "STZ",
        "mode_after": {
          "emulation": false,
          "m8": true,
          "x8": true
        },
        "opcode": 156,
        "pc": 35858,
        "size": 3,
        "target": null
      },
      "rom_offset": 3090,
      "status": "decoded",
      "unresolved_reason": null
    },
    {
      "identity": {
        "mode": {
          "emulation": false,
          "m8": true,
          "x8": true
        },
        "pc": 35861,
        "processor": "sa1"
      },
      "instruction": {
        "addressing": "immediate8",
        "bytes_hex": "C230",
        "flow": "next",
        "mnemonic": "REP",
        "mode_after": {
          "emulation": false,
          "m8": false,
          "x8": false
        },
        "opcode": 194,
        "pc": 35861,
        "size": 2,
        "target": null
      },
      "rom_offset": 3093,
      "status": "decoded",
      "unresolved_reason": null
    },
    {
      "identity": {
        "mode": {
          "emulation": false,
          "m8": false,
          "x8": false
        },
        "pc": 35863,
        "processor": "sa1"
      },
      "instruction": {
        "addressing": "immediate_x",
        "bytes_hex": "A20030",
        "flow": "next",
        "mnemonic": "LDX",
        "mode_after": {
          "emulation": false,
          "m8": false,
          "x8": false
        },
        "opcode": 162,
        "pc": 35863,
        "size": 3,
        "target": null
      },
      "rom_offset": 3095,
      "status": "decoded",
      "unresolved_reason": null
    },
    {
      "identity": {
        "mode": {
          "emulation": false,